image_id,labels,transcriptions
1234,1,90 PARITHABAIGII வ ஊர் சுத்தி லல ப்ப இவதான் ஊர் சுத்தி தான்
1146,0,~மச்சான் என் ஆளு என்ன விட்டுட்டு போய்ட்டாடா ~விடு மச்சான் . சரி எதுக்கு விட்டுட்டு போய்ட்டா???? ~தெரியல மச்சான் reason சொல்லவே இல்ல ஆனா போகும்போது five star ad பாக்கசொன்னா ஒனக்கு தெரியுமா மச்சான் ஏன் பாக்கசொன்னானு 5
562,0,~PS-2 trailer எம் dharshan. _ ஏ0UEInari Ennada oruthanum mathika matreenga? IG LEVEL MEME$ = = = LFVFL
833,0,In Computer Lab *Me MASAAL VADA MJAS *Friend Dei dei Off pannirathadainnumsavekudapanala
51,0,Kabakura Tarou Yesterday at 9:42 PM Innumada Middle finger la Nail iladhada round panni 18+ meme ah potunu erukinga Mmala Oru nimisham irra sirichikiren
1031,1,அம்மா தோசை ஊத்துறேன் . சாப்டு தூங்கு டா . போமா Daily தோசை தோசைனு நா வெளிய Hotel ல சாப்டேன் அம்மா என்ன சாப்ட தோசை தான் V ] BrO
712,0,Me seeing girls wearing black dress and talking about the same .99 Namma propose paniruvomam Adhukku precautions tharangalam LEVFL WEMES = = VER^ L[VEL
1173,1,வீட்டுக்கு ஆம்பள பய அழக்கூடாதுன்னு சொல்லி வளர்க்குறாங்ளே அதே ஆம்பளய அழவைக்காதடின்னு பொம்பளப்புள்ளய சொல்லி வளர்க்குறாங்களா?? ^010 வீடு
168,0,Muthu Kutti Just now #muthumc me En pola Enga porathu bug
1677,0,நாளை முதல் அனைத்து மகளிருக்கும் சாதாரண கட்டண நகரப்பேருந்துகளில் கட்டணமின்றி பயணிக்கலாம் VIII WEMGS
1778,0,கொரோனாவுக்கு வாயையும் மூக்கையும் மூட கருப்பு பூஞ்சைக்கு கண்ணை மூட சைனா காரி உங்க ஊர்ல காதை மூட்றதுக்கு எதுவும் வைரஸ் கண் டுபுடிக்கலையா ??? கட்டத்தில் ஈஅான். னம் னும் ன்டி
630,0,Mc Muriel Just now 00 Only money can fix me Only doli can fix me Only travel can fix me Only marriage can fix me apo kadaisi vara nee ethumey panna mattiya da paavi #mc_muriel ல3
1608,0,Mention that ulaga level playboy Evalo periya figure ah irundhalum naal kulla ushar panniruvan Orey
129,0,Muthu Kutti Just now Sis inaiku night enna ma dinner Mom : dhosai um palaya soorum Sis: palaya sooru yaaruku? naaika poonai ka Mom : anga moonavatha oruthan irupanae Thanda soru me coming from my room : #muthumc MUTHU MC
1030,1,Nobody Beggars In Bus Stop IIIIINIIT SapttuasnauNaaaSaasaam Saarn 000@ TIMIL +FMI] டேய் NATIONAL CRUSH பா அவ
859,0,Priyanka mohan 1@ JERRY M@ _TMN FUVN KUMMI E.O Me* Aval mugam paarthu Naan indru thadumaarinen
1570,0,Nainar MC Just now பொண்ண தொட்டநேரம் விண்ணை தொடலாம் ன்னு சொன்ன எவன்டா . #josiyakaran Nainar MC Newly married தா*லி Guy
1346,1,HAT ONE GIRL W oUR CUASS NALLA PAAL AAADU AARI !eUw7o SENAIYA FOOD YEIUvA
1038,1,காலைல எழுந்துருச்சதுல இருந்து. என் அம்மா என்னதிட்டிகிட்டே இருக்காங்க டா. எரிச்சலா இருக்கு சீக்கிரம் என்னயஉன் வீட்டுக்கு கூட்டிட்டு போட. te
1673,0,அனைத்து மகளிரும் சாதாரண கட்டண பேருந்துகளில் மே 8 முதல் கட்டணமில்லாமல் பயணிக்கலாம் முதல்வர் மு ஸ்டாலின் ஆண்கள் அப்போ இனிமேல் பொண்ணு வேஷம் போட்டு தான் பஸ்ல ஏர்னுமா ?? நகரப் நாங்க
86,0,Dharshan Just now Me in everyones life #dharshanmc மாt
1095,1,un kuda 1OO vorusom vozhanum ~ne illana sethuruven da ~avan ennoda frnd than nigh+ nef on panni vachuru +hoongeten Q.L taz.il pasanga Indha mathiri ponnungola love ponnavum bayama than pa irukku
1302,1,athu mattum vena da pls en chellam Ia vera enna vena panalam She na full company kudukuren aana athu mattum vena da pls
934,0,NOMATTUMSOLLATHA Enjoy Enfami Ivan yaru namala over take pannitu poran pora speed ah patha #Trending 1 aagiruvan
1228,0,கன்னியாகுமரி RAII 08 யாருமரி 90s Kids நினைவுகள் டிசம்பர் பூவலாம் தலையில பாத்த கடைசி தலைமுறை நாங்க தான்
407,0,muthu mc @muthu kutti Le me know all the shortcuts in Excel Junior girl : Kai vilayadudhu Excel la Me : Evlo yrs ah work panitu irukom Amuthumc LFVEL 5:06 PM 3
437,0,Recent times la Semma crime thriller movie
1183,1,என்னதான் தலையில பூ வைக்கிறது கலாச்சாரமா இருந்தாலும் ஒரு நியாயம் வேணாமாடா G 0 8 நம்ம
248,0,Dharshan Just now ~Chennai nalae gethu dhan bro :Ohh nee Chennai la endha area bro?? ~Nan gummidipoondi bro #dharshanmc ~ mt LEVEL MEMES = = VERA LEVEL
1387,1,ஹேய். சப்புனது போதும்டா. இதுக்கு மேல என்னால அடக்க. முடியாது புதருக்குள்ள தூக்கிட்டு போய் செய்யடா..
1776,0,அப்றம்ஜானு என்னஇந்தபக்கம்? சிங்கப்பூர்லஉன்புருஷன் குழந்தைங்கசௌக்கியமா?
147,0,Muthu Kutti Just now *When itis your friends marriage* Neraya velaya vitutu unakaaga vanthu irukom nee tha room arrange panni kuduthutu bachelors party vachutu pora #muthumc GOUDMINES
183,0,Indha song oru maari manda kulla ooditae iruku mo dharshan _ LEVEL WEMES$ = = VE;^ LEVEL
1661,0,நந்தினி. பஸ்பாஸ்ரினீவல் பன்டேலா ? SUmWSIBIUWIIS #AMBI #NANDHINI னிமேஎங்களுக்குபஸ்டிக்கெட் ஃப்ரீ டாவெண்ண
1289,1,un kannu angaye pona anubavikka aasa varathanda seyyum pakathu veetu aunty athulaye irukaatha epomey ok va normal friends ah irukalam nama epomey ok
661,0,When she doesnt know what is Instagram -^ dharshan _ mt Romba romba rare piece chettiyar LEVEL MEME$ = = LEVEL
512,0,Weekend yarachu work povangala vishal sammy_ Sqppot dood Naanga povom
1213,1,என் பட்டமே பற பற பறக எல்லைகள் தாண்டி பற பற பற் That Pattam  இஷ மயிறுக்குலாம் பறக்க முடியாது Download Dailyhunt on Play Store
850,0,Enna Vena Nadakattum Na Sandhosamalrupen!! SuddenlyaAyugayennammakoodapesamaatiaga?33 DAPRA MEMEZ
1199,1,பிறர் அன்புக்காக ஏங்குவதை விட சாப்பிட்டுத் தூங்குவதே மேல் 8 இந்தியாவின் #1 ஷார்ட்நியூஸ் யag2neயs டவுன்லோட் #IndiaReadsWay2News ஆப்
1347,1,"Starting Thangachi ithellam thappu Na Few uhnutes latar AC""o5s Innum veaama kuthu Na"
457,0,mrrathna Decoders anga paaru photo la padam LCU than vishal_sammy_ Konney puduven avar travel diaries pic potrukaru Hey
252,0,Muthu Kutti Just now Coding um theriyama English um varama Naragam pa naragam #muthumc
1364,1,Me : yenga... nalladhana ofuneenga en niruthitinga? She avlo comfortable ah illa. Me : Adha cushion seat iruke podhadha! No167 Sho GILMATNMILMEMES PhotoGrid Seat illamale irundhrukalam. up and down panna vasadhiya iruku. qde
755,0,IO Leo @M 0510 UA (2D) (Tamil) Date Tme Thu
53,0,Enna vara vara bad dream ah vey varudhu vishal_sammy_ mt ^3
1415,1,Chen thambi showshistongue skills @Kettavan memez 2.0 *Akka Sssbhoa mudiga ilukathada thambi @எbbmethovacலm
725,0,BANGAM GUBEER MEMEZ Today Tomorrow Monday morning JI 0 Corona& Omicon ப 0 Im CEAT உ1 எனனால நம்பவே முடியல் வங்கலாம் பைத்தியமா ருப்பாங்கனு
1247,1,சிரிக்கலாம் வாங்க மனைவி : எல்லாம் படிக்கும் மாறுவேட போட்டியில ம் போட்டதுக்கு எனக்கு இரண்டாம் பரிசு கொடுத்தாங்க கணவன் ம் போடாம சும்மாவே போயிருந்தா பரிசயே கொடுத்து இருப்பாங்க மனைவி 0 ஹலோ 108 2 காலேஜ் நான் போது அரக்கி வேஷ அரக்கி வேஷ முதல்
1448,1,*sis Deii Anna enoda teddy bear yega da d@o Athu en aaluku aift ah kuduthutev *bro
925,0,என் மதிச்சாதான்யாரையும் மதிப்பேன் அதுமத்தவனா ுந்தாலும் சரிஎன்ன பெத்தவனா ருந்தாலும்சரி 60 Ihouguy இ்டப்பட் கோமாள0 வேலைக்கேபோகாம் இருக்க உனக்கு டெய்லிமூச்சு சோத்தபோட்டதுக்குஎங்களுக்கு இதுவேணும் முட்ட
324,0,muthu mc @muthu kutti Enna nga insta la neraya reels send panne onnu kooda paakavae illa Konjo work busy atha. Amuthumc 1:25 AM * Aug 16
1304,1,Moonja paathu pesura pazhakamey illaya da unaku Anni
951,0,Kesari ah sapdum bothu mattum thondaila eranguthu. (08 *Rava AN Upma va sapdum bothu adachikutho.
398,0,Sanjay Krishna Just now Thala apdiye IPL mudichutu vivasayam paaka poiraathinga Oru aal koraiyuthu vanthu WTC final aadi kuduthutu ponga. KUIUn V E1 L & KUILL AWEWE  = LFVEL
1283,1,inum unga pondati sambalam kudukala;neengalachum correct ah kudunga velakari sambalatha sonnan aaahhhh sshh valikuthunga methuvaa
1101,1,நாம சொல்றது பொய்ன்னு தெரிஞ்சும் நம்புறது அம்மா. flalwzsmle யாரோ சொல்றது உண்மைனு தெரிஞ்சும் நம்பாதது மனைவி
1572,0,me Aunty போன மாசம் 10ம் தேதி 4 தக்காளி கடனா வாங்கிட்டு போனேங்களே me தேவைப்படும்போது கேளு சான்னேங்களே நியாபகம் ருக்கா. ப்ப தேவைப்படுது . தரேங்களா ஈrix&l& neighbour She தரேன் வேற
64,0,Dharshan Just now 8hrs continuous ah mama ~Work ah mapla? Work ila overthinking mama #dharshanmc mc
378,0,Kedhar hit the first ball in the season to boundary mட vishal_sammy_ & TAM MEMRS 747+70+4 7~0 45=00
1376,1,un aasaiku evan evanaiyo kootitu varuva na avanukellam virikanum wife aana na mattum en aasaiku oruthanayum vechika kudathu la
23,0,Hansika's Love Shaadi Dramanow streaming on Disney+Hotstar ISO Meafter watchingclimaxoffirstepisode ~ mட mt Edhir paakadha alavuku shock kudukuringalae da
538,0,When you comes fo know that youre nothing 1o be mean in someones Life L[YF1 AFRIN Appo naantha soker ah?? m
1237,1,அம்மா தூங்கிடாங்களா இன்னைக்கு DALGONA OFFEE செஞ்சு பார்களாம் Little princess மண்டபதரம் மீம்ஸ் Amma அடியேய் கய்ல காசு இல்லாமா எதோ இருக்குறத வச்சு சாளிச்சுட்டு இருக்கேன் பைத்தியம் போல எதாவது பண்ண உன்ன அப்படியே கொண்றுவேன் 1/1
309,0,Muthu Kutti Just now Juice kadakaaran extra juice kudukurathula lucky fellow ila ambhi #muthumc
231,0,இரவாகஇருக்கும்உன்வாழ்கை.. விடியும் பகலாகஒரு நாள். Motivation mairaandi Save for later Follow 1or mமOre
1010,0,Mom to me Dei clean shave panu po *After clean shavex Mom: Enna da ponnu maari aaita &whole family laughing me +1 chcllol pooi
642,0,Muthu Kutti March month full ah WFH vangi tharen nu thane sona #muthumc GOUDMINE *me *TL m
462,0,MI comeback da அ 00II L Paltan 1 Paltan2 vishal_sammy _ அம }l
1693,0,without HER' even HERO' is 'O' Huppy Women | $ epdie Ch Ouagum Duy
679,0,Apro ipdi wallpaper vachu iruka naala naa committed la illangha Aal uh tha illa wallpaper aachum nalla irukatum nu suma vachenga avlotha #muthumc 9:11 Froa17/0? ~111 VUTபUMG
1372,1,ராவடையை நாக்கை நக்குதல் தூக்குதல் விடுதல் 08:06 MUVIL சப்புதல் உரிச்சுதல் கடித்தல்
1551,0,Wife : நான் ஊருக்கு போய்ட்டா சாப்பாட்டுக்கு என்னங்க பண்ணுவீங்க Hus: சாப்பாடு கெடக்குது சாப்பாடு . மனுசனுக்கு நிம்மதி தான முக்கியம்
633,0,Agilan movie sneak peekis out now ! Pramadhama irukum Agilan padam pola
657,0,CANT BELIVE HE IS 38 SWIPE LEFTTO NOW ABOUT HIM >>>>
556,0,Muthu Kutti 1m #salaryday #muthumc
465,0,MUTHUMC @mIUIப KUI Some one How many days you work in a week?? Support Jood : AUIHU
955,0,:Yaaru Yar kittaoutAninga..? Bogo CIEII JPR NUI BAI KINGJ நஅAுNS CHAEONNGEIS MrMemeskaaran 4G
1253,1,Anandmemes மாமியார் சாம்பார்ல மீன் போடலாமா போடக்கூடாதா பதில சொல்லு மருமகள்
430,0,Ipdidhan be@st uh trailer um 0 0 0 dharshan _ LEVEL MEMES = = VER^ LFVEL
807,0,"Vetri Mra Just now *Me using Template Sticker and emoji to keep ^ up the conversation Me : intha 3num namma kita illama namma polappu naridum naari. !! காத்திருந்தா க் IUIIN PIJI veri a "" ப0மo Jovm"
832,0,"mc Me Un rubber Ia kojam அழிச்சிட்டுதரன் ? My frnd மவன் மம்ஸ் ~5 Dei..Dei பாத்துட மேல ருக்கற cover ah kizhichidatha da.? dBSL eraser apsara +101: ம0"" சnப ச9.9 Nor"
1058,1,When Mom cooking Upma in home Sis B[O J Io WAEECOIE Mom Ennada idu ellam saapdama poranga !!
868,0,CM செய்ய ணமில்லை mட Cha Ena manushan ya 5860 மகளிர் பயணம் கட்ப ~EB
290,0,Mall la bargain pannathavanu Matha kadaila bargain pandravanu oorey aala ப!!= Swathi mc LEVEL MEMES  = = VER^ LFVEL
177,0,-&) Macha ennaya support project la tag pannirukanga da LEVEL dharshan *Mealeyin SqppoIUprOfect Maatikitta pangu LEVEL MEMES = = VER^
30,0,Enaku ennamo iniki leo trailer perusa sambavam pannum nu thonudhu dharshan LEVEL MEME$ = VER^ LEVEL
1522,1,"ஆடி மாசம் உன்னை கூட்டிகிட்டு வந்துஃ. இந்த நாளு நாள்ல எட்டு தடவை ஆன்லைன்ல food ஆர்டர் பண்ணி இ 0@6 Daughter mom இவள வெச்சி வாழுற அந்த மனுஷன் அதான் மாப்ள தெய்வம்மா. P memes GSu000""581 ருக்க"" நம்ம"
156,0,60 0' Me Hi friends ivan dhan enna crush solitu neraya pick up lines solitu irukaan Mycrush going to eat apyy he gives O mme now Anyways naan idhukellam masiya poradhu illa bye LEVEU WEWE = L[VEL
1082,1,Saracha @VN உன் முகம் ஞாயிறு உன் கண்கள் திங்கள் 09 ன் உதடு செவ்லாய் உன் கன்னம் புதன் உன் மூக்கு வியாழன் உன் பற்கள் வெள்ளி மொத்தத்தில் நீஒரு - சனி
517,0,People who continuously sends reels AFRIN *Me இந்தா யாபுடி
663,0,MIUTHUMC இய்பாரப lme trying to sleep peacefully* That one braln cell : ~L_U
1583,0,Glns G3GL6 வளாவது ராமுவ.லவ் பண்ணீருப்பா அதையும் கெடுத்து விட்டுட்டு போயிட்டா  இந்த ஜானு.
483,0,Muthu Kutti Just now Macha en pakathu la evano suduran da Athu bot uh murugesha #muthumc
573,0,Muthu Kutti Just now When u made the changes but u forgot to save the file Your System #muthumc
1703,0,Facebook irukura ellam pombala pullaikum women s day wish pannuran CIXSISIVI veedula amma nu oruthi kuththu kal ah iruken oru wish pannuran ah paru.??? happy
927,0,Mudi romba kottudhu macha Motta adichitu kannadi #vindiesel mari irupa macha ne Navinzujs ris mc pota mt
1758,0,brofher sister relarionship expecfation நீ சொன்னால் எதையும் செய்வேன் தலையாட்டும் பொம்மையாவேன் reality sisrer கிளிப்பான் அவன் கிளிப்பான் ரிமோர்ட் கேட்டாலே தர மாட்டான் டிவி
57,0,Dharshan Just now Me shares reel to my friend That nanban reacted with smile emoji Kondae puden nan send pannadhu humanity reel uh
246,0,Mc Muriel Just now Me handling others prblms vs me handling my prblms #mc_muriel
1037,1,காலம் பூரா உன்னைய மறக்க மாட்டேன் டா அடுப்புல பால் வச்சாலே மறந்துடுவா துல காலம் பூரா எனனைய மறக்க மாட்டாளாம் இன்னும் என்ன நீ பைத்தியக்காரனாவே நெனச்சிட்டு இருக்கல்ல
191,0,mr I- my அடிக்கடி வருவேன்
1734,0,அழுதே கின்னஸ் வென்ற நைஜீரியர்! ஆண்கள்ட அழுதே எல்லாத்தையும் சாதிக்குற ஒரு பெணணால் கூட உலக சாதனை படைக்க முடியலயே  02:09:17:36
1524,1,"மருமகள் சமைத்த சாம்பாரை சாப்பிட்ட மாமனார் மாமியார் பரிதாபமரணம் தெரியாமல் ண்ட பக்கத்துவீட்டு சிறுவனும் பலி @Kirukkupaya1987 AThat 2k Marumagal காய் எதும் கெடைக்கல அதான்கீரைய பரிச்சி போட்டு சாம்பார் வச்சேன் எனன கீர.??? கீர"" அரளி"
345,0,muthu mc @muthu kutti Naa love panna la ponnu venum nu kekala Just Frndly ah pesurathuku oru ponnu venum avlotha. Amuthumc 8:31 PI 27
4,0,JISURIEIITHTIUII HALLUCIIATIOIS HISTERIA SL[EP IS SURVIVAL. GIII1 ஈuU1IG111 SWAHI[ஈ 140[ஈ$01 I[WWIIFா 1450# 1[/ப1 AWAKE JUNE 9 N[IL _vishal_ sammy_ Uட Nallaplotandstoryaana ivalo summaraheduthuvachiruka
40,0,ஓயபVAW^ Vazhkaila mahaan ah vazhurathuku mansuku pudicha maari oru naal vazhndha podhum vishal_sammy
835,0,Varun Abhishek unna nambi yoga pannathuku unnala enna panna mudiyumo atha pannita
280,0,Mc Muriel Just now Aiyaa unga Na ready edits lam kevalama irukku ya. Thayavu senji atha milk panratha niruthunga ya #mc_muriel Bdit guys
1507,1,ஏம்மா எங்கிட்ட வாங்குன பணத்தை எப்பம்மா / திருப்பி தருவ.. wP memes TUCசDOUK LUT/vPTele iv -TL நாளை நாளை என்று. MUSSODIA நம்பி ரு மனமே.. $mUSY3bA
994,0,அப்போலாம் தலைய சொரிஜ்ஜா மட்டும்தான் விழும் 8 0 ஆனா இப்போ முடியும் சேர்த்து விழுதே தூசி இeஇூ
625,0,என்னடா வர வர என் கண்ணுக்கு amala shaji லாம் அழகா தெரியுறா   ?? ~காஜீ முத்திருச்சுனே
778,0,LakshmiMv @mvlakshmibe56 She: Ungaluku ennalam pidikathu? #Fiance: Makeup items
852,0,சுடுகாட்டு பேய நம்பு சொந்தக்காரநாய நம்பாதே .
1197,0,ATKA என் நெஞ்சில் ஓர் பூ பூத்தது அத் பயர் எண்வபெ் கேட்டேன் கமிழர்கள் பூத்தபூ மட்டும் தாமரை ஆஇருந்த கும்மபிடுவேன் கும்மி ாை Download Dailyhunt On Playstore
1595,0,GollllteL இந்த பூலோகத்தில் யாரும்பார்க்கும் முன்னே 0]6760 அதிகாலை அனப்பி லைப்போம் Singles -97071 ஓகோ கள்ள தொடர்பா
1720,0,"+140w ~U1 அடுத்த நிமிடம் கூட நமக்கு -104W 4/11 நிச்சயம் இல்லை 4~  =/4111 இதில் திமிர் வெறுப்பு கோபம் 1E ணவம் போன்ற 11 7 1 -9[T"" +11 TAMILVOICE OM 1411 அழுக்கை சுமந்து சாகாதே!  அன்பை மட்டுமே -14#000  Luw .LC நேசியுங்கள் !"
479,0,Muthu Kutti Just now When baby is trying to talk Amma sollu amma Appa solu thango appa. Hmuthumc ககரIபைII NUTHONG ககருப்மைபா பவதை
1678,0,"அ1 சாt kaiya kudu doli ve I."" womens DP day Happy"
95,0,Vaishu after mater with cheenu mt Mottamadhan Enta edhachum sollanuma??? dharshan _ mt Ila da nanga rendu perum group study dhan pannitu irundhom LEVEI MEME5 = = VE; ^ LEVEL
513,0,"When my friends make plans without me ஈ* +^. Iட wondered What did 1 do Wrong?"" L[V6( W[#E. = L[VE-"
719,0,Konjam aachum future ah pathi yosi da! / naamadlarum avlo future orunaal la illa sethuruvomla
305,0,Muthu Kutti 2d por thozhil movie* Nee inga ivaluku paathukaapu kudu Anga avan un aal ah thookitan #muthumc *in
85,0,Ayya apdiye oru 20 years future la kondu vitrunga ennala indha pressure ah thaanga mudiyala mc Iட poi LEVEL WEME$ = = L[VEL
265,0,60 0' Me Hi friends ivan dhan enna crush solitu neraya pick up lines solitu irukaan Mycrush going to eat apyy he gives O mme now Anyways naan idhukellam masiya poradhu illa bye LEVEU WEWE = L[VEL
1539,0,டேய்தம்பி ஜல்லிக்கட்டை விட வீரமான அபாயகரமான விளையாட்டு ஒன்னு சொல்லவா  ? சொல்லுங்கண்ணே தாலிகட்டு
24,0,muthu mc @muthu kutti $ Xna MALEIFEMALE nu ennaku therium #muthumc 11:32 AM Feb 27
1180,1,முன்பெல்லாம் காளையை அடக்கினாதான் பொண்ணு தருவேன்னு சொன்னாங்க இப்போ பொண்ணை தந்துவிடுகிறோம் நீங்களே அவங்களை அட க்கிக்கோங்கன்னு சொல்றாங்க
714,0,Vaathi on theatre from feb 17 Indhascene ku theatrelasambavam iruku
1214,1,-பர சன்ற 45114 .107~0 G4 பப அ_#700 @~11ட71 9.-700444502 டய- 4 .4 #4~5 ம/ 14
217,0,Mc Muriel Just now minnows kooda 1oO adichittu rmba scene podranga KohlipRohit illana nammaley minnows thaan da deiii #mc_muriel 181 182/4 (40.5) (36.4) IND WI WI won by 6 wickets (80 balls lefty ODI 2 of 3 (Tied 1-1)
866,0,ZEEதமிழ் SUBUB survivor Lakshmi Priya nenga entha mathiri task evlo tough ah kuduthalum sari tm Lakshmi team captain ah irukura vara intha sword avanga kaila than irukum 1@ Priya
78,0,Sanjay Krishna JUST now Narlippu arakkargal at Ineir busIFeS5 cummy ODI sETIES JUSI nefore an toUITamTerIt The actual ICC tournament ICC
782,0,Enna da baby today leave ah Aama di Gandhi Jayanti la Jayanti ah nee enna thavira vera endha ponnu name ah yum solla IIURRR FIJI kudaathu Sari sari ok Message Qprgbo de villiers அப்டி ஒரு உருட்டுடா அது
331,0,Indha song oru maari manda kulla ooditae iruku mo dharshan _ LEVEL WEMES$ = = VE;^ LEVEL
1663,0,அனைத்து மகளிரும் சாதாரண கட்டண பேருந்துகளில் மே 8 முதல் கட்டணமில்லாமல் பயணிக்கலாம் முதல்வர் மு ஸ்டாலின் / All boy s be like நகரப்
