image_id,labels,transcriptions
1500,0,Sharechat @easwari2 மரணம் வரை மாறாத அன்பை உன்னிடம் மட்டுமே எதிர்பார்க்கிறேன்
3,0,Dei ennada ivalo peru commited ah irukinga mc vishal_sammy_ 9 mt
706,0,Ivan ennanga politics vida mosama irukan 0 BCCI LEVEL WEME$  = = VER^ LFVEL
1628,0,அம்மா தூங்கிடாங்களா இன்னைக்கு DALGONA OFFEE செஞ்சு பார்களாம் Little princess ம்டபதரம் மீம்ஸ் Amma அடியேய் கய்ல காசு இல்லாமா எதோ இருக்குறத வச்சு சாளிச்சுட்டு இருக்கேன் பைத்தியம் போல எதாவது பண்ண Iை அப்படியே கொண்றுவேன் 1/1
1194,1,AI கன்னியாகுமரி கன்னியா : Raki G சிறந்த கணவரால் மட்டுமே மனைவியின் ருமல் சத்தத்திற்கு கூட என்ன அர்த்தம் என்று அறிய முடியும்! அவர்களால் மட்டும் வளைந்து கொடுத்து வாழ்க்கையை வாழவும் முடியும் குமரி
1238,1,மடடும் மூணு வேளைக்கும் நல்லா திங்க தெரியுது girls *Mom வீட்டு வேலை செய்யுனு சொன்னா மட் ரோசம் பொத்துட்டு வருதேழ Helo சோறு மம்
292,0,Thandatti movie in theatres onJune 23rd ! Get ready for the fun filled ride Romba naal aprm namma Pasupathu full fleged Role panraru Comedy genre la
1118,1,She Unna 4 Varshama Dhan Da Therium. Aana Enga Appa 24 Varshama Ena Valathu Padika Vechu Ena Nalla Pathukitaaru
9,0,When she says Bus eritu call panren and didnt call. she might be Actually She siar தந174 /[1477 LEVEL MEMES = = VE;^ LEVEL
1020,1,mt Make up poduven CAAZI GIRL I வட #bestie Ana
341,0,Sanjay Krishna mir Uாes auC Hol got rcauy for Thala 5 retirement speech Ho it endeu!ll
1499,0,ஒரு பெண் ஆண்மகனால் பலமுறை மனதளவில் காயம் அடைந்து விட்டால் அவன் மனம் மாறி அன்பு காட்டி நெருங்கி வந்தாலும் நிச்சயமாக அவனை புறக்கணித்து விடுவாள் TS kavithaigal ஓர் பிறகு
926,0,gospparithabangall புது படம் ரிலீஸ் ஆனா உடனே யூடுப்ல ரீவ்யு பாத்துட்டு தியேட்டர் போனவன் இல்ல டா VIKI MEMES டாப் 10 மூவிஸ் புது வரவுல எதா ஒரு சீன பாத்துட்டு படம் பாத்த மாறி சீன போட்டுட்டு எப்ப டா சன் படத்த போடுவான்னு காத்து கிடந்த 90ஸ் கிட்ஸ் டா டிவில
979,0,Appa Dei Konja neram TV ah off panra Pavaam evlo neram tan rest eh illama odikitu irukum .!! trendingmemes *TV TRENDING !EMES Cha enna manusan ya.!!
1501,0,சேரி மா Sa என்னங்க கடைக்குப் போய் பிரியாணி வாங்கிட்டு வாங்க மதியம் பையனா திட்டிடேன்
359,0,Muthu Kutti 3m Travelling with my friends In car *In stand up call* Me : iam working on that ticket will complete it today #muthumc *me frnds *my
1263,0,அம்மிகல் ஆட்டுக்கல்ல பயன்படுத்த மாட்டாங்களாம் ஊர்க் கிழவி பிரசவம் மட்டும் நார்மல் டெலிவரி ஆகுனுமாம் Download Dailyhunt on Play Store
262,0,My mind is outta nowhere at 12.30 am in a loop mode: Naan ready dhan varava annen naan erangi varava seendaadhappa tovv to to tovv tototovvv Me: மட LEVEI MEMES = = VE*^ LEVFL
742,0,Vetri Mra Just now Manager . nalaiku oru task Iruku you should come to Office early. Me : naalaiku Naa Sick Leave hu..!!! varataahhhh..!! mc m& IIUINR PIJII veriwra
238,0,Muthu Kutti Just now *Got escalation from client* Manager Task ah mudikkama enna ma pannitu irundha Doodie Reels panitu irundhen sir. #muthumc
1178,1,In Maamiyaar Veedu Dads Little Princess இன்னைக்கு சாப்பிட என்ன செய்ய போற அதெல்லாம் சொல்றதுக்கு இல்லை செஞ்சுட்டு பேர் வைக்கணும் தான்
1061,1,என்னடி Call பன்னினா Busy ன்னு வருது #She- customer care Call பன்னினேன்டா ~எது Whtsapp la யா that ஈDWA மண்டைல ருக்கிற டைய மறந்திட்டனேடா க்கு girl கொண்
315,0,Adhan evlo prechana varudhu la breakup panikalam la LFVEL I Myfrnd Romba Dhooram vandhuttom full ah mudichutu dhan return varanum LEVEL [WF$ = = =
1107,1,உங்க பொண்ணுக்கு 30 லட்ச ரூபாய் செலவு பண்ணி கல்யாணம்பண்ணீங்களே .0 1 பொண்ணு எப்படி இருக்கா? அவ நல்லாத்தான் இருக்கா . மாப்பிள்ளைதான் '50 லட்ச ரூபாய் தர்றேன் மாமா என்னைக் காப்பாத்துங்கனு கெஞ்சறான்
1423,1,Aah dei un aal breakup pannita nu solli feelingla irupanu partha enna ipdi seiriye da ^:^0 Woja Ssh. medhuva vitu edu da poruki aaah hmmm WojaSFor Memes Un aalu pona ena adhaan un bestie irukenla da En lovera vida ne dhan da nalla seira aah vegama adi da un aala nenachi enna sei da Srar Wemes
1303,1,friend dei enna da engamma va short film nadika kooptutu ipdi ukkara vechu shoot panitu iruka friend amma Me kathaiku yetha mari than da shoot panitu iruken friend Appadi enna da kathai;title enna ?
583,0,Muthu Kutti m Me : vaa briyani saapuda Roomate : ippova?? Me ipotha Roomate aie ipo neram enna aaguthu theriuma #muthumc *me *roomate pola
458,0,Muthu Kutti m Hair cut 1 side cutting Mutta 1 side omlette Luv Tside #muthumc MUTHU NG
410,0,*Opponent King Vera_ level memes Naaa Kannadi Maari la
907,0,9os KIDS WWEMEMORIES PHAIASII SUFUUHE  7~7 #!5mesl அண்டர்டேக்கருக்கு கெயன் மூஞ்சில ரெண்டு ஏழு ஆசிட் பேரும் ஐ ஊத்திடாங்க. அண்ணண் தம்பிங்க இவங்க யிர்
965,0,பக்கத்து வீடல ஒரு சின்ன பையன் இருந்துட்டா போதுமே இன்டடி8 *நான் Fa பuர~ 11EAIBS உடனே கடைக்கு போய்ட்டு வா பால் வாங்க போய்ட்டு வானு வ்தருவிங்களே
1174,1,Me : பேசிட்டு இருக்கும் அம்மா வந்தாங்கனு கால் கட்பண்ணிட் உ ஏதும் கோவம் இல்லையே.! She சே சே.. இப்போ கோவப்பட போறேன் இத அப்புறம் ஏதாவது சண்டைக்கு பூஸ் பண்ணலாம்னு Note பண்ணி வச்சிப்பேன் ! 1( 79 0 போது டேனு னக்கு நான் ஏன்
1471,1,அங்க ஏதோ விட்டுட்டுவந்த கடைல ஏதும் ல்லைங்க உங்க மாதிரி இருக்கு HANDBAG PURSE இல்ல LIPSTICKAH அதுக்கெல்லாம் உயிர் இல்ல ஏங்க கிளி ஏதும் வளக்குறீங்களா நான் விட்டுவந்ததுக்கு உயிர்இருக்கு அத விட்டுட்டு போய்டீங்களா மககு கூ மக்கு கூ
189,0,Muthu Kutti Just now After leaving office 0 TL -~ can you connect now regarding a critical issue? Romba dhooram poiten #muthumc mt
651,0,Muthu Kutti m Night aana thukkamae vara matainguthu doss anna #muthumc NUTHONG
1083,0,Ammu Kutty online 5:14 PM Yen sogama irukka babe 5:14 PM Enga appa amma enakku niraiya senjurukangada 5:15 PM Aana avungalukku naa onnumay senjathu illa 5:15 PM விரைவில் விபூதி என்பதை போதிதர்மர்  ணர்கிறார் L
1725,0,நேர்மையான ஆணுக்கு Romantic ah பேச வராது !! நேர்மையான பொண்ணுக்கு பொய்யா நடிக்க வராது. எதையாவது சொல்லுவோம்
1760,0,"சுதந்திரம் வார்த்தையில் கூட ஆண்களுக்கு சுதந்திரம் இல்லை. KG MEIES RG LIEIES AUTAYS EEHAFPU சுதா இந்திரா""ன்னு பொண் ங்க பேருதான் இருக்கு. ங்கற"
29,0,After the blockbuster Thiruchitrambalam director MithranRJawahar to direct Madhavan next
326,0,Dharshan Just now She : Feel free to talk ra Morning aai poniya #dharshanmc @t
1333,1,MBBabyna venahelppanava? 5 WieOnnuveam mootbunga ahepodhum on Faizz
1249,1,SETI LrI dailghunt Google Play அந்த. காலம் ந்த. காலம் அது வசந்த அது வசந்த&கோ காலம் காலம்
1223,0,TAMILYLELUW TAMILYIEECON சாப்பிடும் போது TAWILWDIEOW IH1IHICEO பாக்காதீங்க சாப்பாடு டேஸ்ட்டே தெரியாதுண +96 JIIIILJOIC )COI சாப்பாடு டேஸட்டா ருந்தா நான் ஏண்டி;T#WL}0ILHL I8W = TH/LILUN T8MILLEI PLYUELDW T#MILWUILEEW டிவி பாக்குறேன் . THMILNLILEUN IAIILAUICELUI THMILWILECU IAMILULECU TAIMILYUICECUI TAMILVOI(ECOM ITamilvoicecom டிவி
1190,1,நாளையதீர்ப்பு (1992) 2022 மீமாண்டி
339,0,Muthu Kutti 3d Me : Inthanga ma mama ungata pesanuma Amma enna da phone ah speaker la avanga pesurathu onumae kekala ithaya 3Ok kuduthu vanguna Me : neenga phone ah cut panitingha ma speaker button mela iruku #muthumc pote
885,0,- Giving Biscuit to friend wantedly during interval in school He : Enmela avlo pasama macha Me : Ama Macha (Le me who giving keela vilundha biscuit) IEரஅS I= 0: me Google Ply
1071,1,மனைவியாக எதிர்பார்ப்பது கைபுள்ள ஆனால் மனைவியாக வந்து சேர்ந்தது ~_டட
1425,1,Irhuku +han da unkuda movie ku vara marrenu sonnen GLNA GILMA *besrie veliya edra pothum Kaiya
1307,1,heyyy nanthan night urinji oru sottu vidama eduthu viten la aprm enna chinna akka periya akka iva kuda vanthu excersise pandran nu solli;enga engayo kai vechu thadavitu iruka
174,0,Dregs Romba naal kalichu short film Ia Indha maari concept pudhusa nallarukku
1481,0,// அடிய.. என்ன மரியாதை படத்துக்கு குறையுது.. போலாமா.. படத்து பேரே 1Wp அடிய.. memes தாண்டி என் வெண்ண மவளே... ^00  vuடcooo rom/5iட oli
503,0,"Muthu Kutti Am Bus a tha family oda vanthu iruken seat maari ukkarungha nu torcher panuvingha nu paartha Theatre la kooda athayae solluringalae da #muthumc _5vE"""
261,0,Oru alavuku mela nammaku sleeping kedaiyadhu & dharshan _ Overthinking dhan LEVEL MEME$ = VE^ LEVEL
1534,0,Eanthajob ah irunthalum girls Ku talent iruntha atha accept Pani chance kodukanum IHIIIL} IIEIE uuRLp Totally Bqualrights for men and women
855,0,அடேய்! அட்வைஸ் பண்ணா ஒழுங்கா அட்வைஸ் பண்ணுங்கடா கைபள்ள அது என்னடா எல்லா அட்வைஸ்சையும் பண்ணி முடிச்சிட்டு அப்பரம் உன் மனசுக்கு என்ன தோனுதோ அதை செய்யுனு என்னைய குழப்பிவிட்டுட்டு போறிங்க
1070,1,Mama Ponnu Expectation:- ஈaUWN ஈ1!095 உனக்கு ஏன் மாமா என்ன கட்டிக்கணும்னு தோணல Reality8 Mama Ponnu online .+91ப960>!0~00~-1*#~ hC Hi 06:19 pm Anna please msg pannathinga anna
1506,1,ஏங்கன்னு இந்த அந்த காலத்து பசங்க பொண்ணுங்க எல்லாம் bestie Crush னு சொல்றாங்களே அப்டினா என்ன புரியற மாரி சொல்லு கன்னு LeJends 60s 70s kids மம்ம் அ அதுவந்து மேரேஜ்க்கு அப்புறம் தான் கள்ளக்காதல் என்று சொல்லுவாங்க இது வந்து மேரேஜ்க்கு முன்னாடி உள்ள கள்ள காதல் அந்த மாதிரி சொல்லலாம்
121,0,Dharshan Just now ~Ellam late ah dhan puriyudhu #dharshanmc
1614,0,Teacher Epdimaveetukoponaudane padikka arambichiifyama Made ப D A / 1 rank girl கடிழ் Ponaudanetlaceacher Dனீப irukombotheypadikkaatambichieBeRin
170,0,Enaku irukka ella prechanaikkum dhooo Idhanala dhan E1 My phone L[V MEWE$ = LFVEL
923,0,12th cbse board exams cancelled சி.பிஃஸ் இ. +2 தேர்வுகள் ஈத்து மத்தியஅரசு அறிவிப்பு IIINHR PIJTU சிபிஸ் இ +2 பொதுத்தேர்வுகள் ரத்து செய்யப்படுவதாக ஒன்றிய அரசு அறிவிப்பு JBEIG LE!S எபி். ப் 0 Gioi எற்து வாபனிச் படய்றியை மற்றுய் பயகாப்பிய் ஸவ Oucகொaப முடயாது பாதமா @charukeshmc cme(howrote o12students Sboardexams) Cமொe
1311,1,yenga oru time mudichutu thoongurarunga unga friend uh full bodhai vera wife kasu vangitan kelambi vanthudava ipove
734,0,. P5155 30 WADE |13 AUSTRALIA BEAT PAKISTAN AND WENT TO FINALS IKIWIS *AUSSIES ENAMAMA SOWKIVAMA CUAINS
1122,1,priya johnson @talksstweet ண்கள் பெண்களை போன்று கண்ணியமானவர்கள் கிடையாது யார் கூப்பிட்டாலும் போய் விடுவார்கள் Translate Tweet 11:17 AM 24 Jul 22 Twitter for Android 30 Retweets 81 Quote Tweets 438 Likes ^ Mohan Krishnakumar 13h Replying to @talksstweet பெண்கள் கண்ணியமானவர்களென்றால் யார் கூப்பிட்டாலும் போய் விடும் ஆண்களைக் கூப்பிடுவது யார் ? ஜய்
1439,1,பேருந்து ஓட்டுநர் பணியிலிருந்து நீக்கப்பட்ட கோவை ஷர்மிளா தற்போது போர் விமான ஓட்டுனராக சேர்ந்துள்ளார் Blazzy Rajesh
1403,1,MathsTeacher டேய் எல்லாரும் ஏதாவது sum போட்டு பாருங்க *Naughty Student Threesum போட்டு பாக்லாமா Miss
780,0,Praba De Villiers @Prabaofficiat98 Veeran. Naalaiyum leave eduka thayaar aanan! IIUIIR FISTU
1416,1,யாராச்சும் பார்த்துட்டாங்கனா பிரச்சனை ஆயிரும் சேலையலாம் அவுக்கமாட்டேன் bestie seihai_ +hodarum அப்படிய.மொ* யை கசக்கிக்கோபின்னாலே அப்படியே சூத்த**ச்சிக்கோ.
1049,1,மைன்ட் வாய்ஸ் : எதுக்கு வ அழுக்கு தண்ணிய டைனிங் டேபுள் மேல வச்சிருக்கா ..ம்ம் புரியல்லயே) ம னவி : என்னங்க ரசம் சாப்பிட்டிங்களா ? நல்லா இருக்கா ?
729,0,கிறிஸ்துமஸ்கு கேக் கூறி ஏமாற்றி வந்ததால் ஆத்திரம் அடைந்த நண்பன் குத்தி BREAKING EWS கொலை ! MASALA POORI MEMES u ுடு Christian friend TIIWIIIII Daz # T; ஈ Cake thariya illa podava தரேன் தரேன் என்று
578,0,"I0 ""Nan refer panren wait pannu nu solluvanga nambadhaa dharshan _ LEVEL MEMES = = VER^ LEVEL"
1271,1,PMt larha memes Love Marriage சினிமாவ காதலிக்காதிங்கடா பொண்டாட்டியா வரவ நம்மக்கு நல்லா சமைச்சி போடுவானு கற்பனைய அதிகமாக வளர்த்து நம்பிடாதிங்கடா . .a0058 Arrange Marriage வீட்ல பாத்து வைக்ர பொண்ணுங்க கூட ஓரு நேரம் ல்லன்னா ஒரு நேரம் மனுசனா மதிச்சி சமைச்சி போடுராளுங்க.காதலிச்சி கல்யாணம் பன்னா எல்லா நேரமும் நம்மளையே கழைக்&o விட்ருவாளுங்கடா  . பாத்து நம்மள
793,0,Sridhar Kuruvilla Just now IAUHHI PISTII *Clothes neraya iruku. aana Outfits kammiya irukae rendu onnu thana !?! illa rendu vera vera @sridharKuruvilla
70,0,Muthu Kutti 19h *when someone asks about my fav person* Nallatha pesuva. suma solla kudathu Enna late ah reply varum avlo tha #muthumc
1366,1,PORIKKI AIIH OHIBIVIIII IOIJIII EI MUIJILI OOIHURIIIU IHINISONIIEIHUKKUIPPO EIVIIILI ROPPUNIHNM IOBI TIIOIOII  II IETTIE ZHTBISOLIUIIIIPHIIUIIUIIROIUIIII IALII PULLIPPIIRUITHILUMTEISII THIIIRUIIUNULUGDRII
646,0,know i am ugly but still used to adjust my hair and see myself in three different angle when i saw a mirror mt vishal_sammy_
1153,1,All i want is Keel veetu aunty like her House owner like her Instagram Qun gaajukuLoru alavillayaadaa Pakkathu veetu ponnu like her Maadi veetu akka like her
1198,1,STUA IETS +1- உலகத்துலயே mackup போட்டுக்கிட்டு உயிருக்கு போராடுறது நீ மட்டும்தான் டி
1401,1,WhenChambitouches akka pussy AAKka AKkaePesitutukumbothukeela yenda kai vaikrasshhaaaroom Kulla vaa Kalatitu Katren thechi vidu
271,0,Mc Muriel Just now periya aasai lam illa sithappa Love song kekkurappo atha relate pannika oru doli iruntha pothum #mc_muriel Iட JனLLLL LLL - CooglePly
898,0,Some Hidden Charactersare Splin Kollywood& Lovedit !! 1 enanansoldrathu Soppana Sundari Kandamanur Jameen ENAITANSOLDRATHUU Thanga Puspam Vtv&96 Trish Husband NS VeerabaguAkka Gopalu
1291,1,dei aunty veetla konjam thanni edukanum variya aunty with innocent ungamma kita na pesikiren onum sollamatanga vaa aunty unaku rendu pazhamum paalum tharen boy
1115,1,crush online dai Enga da irukka?? 20.54 un idhayathula thaan ?0:54 serida mathavangaloda sandai podama silenta iru 20'5- 4 எதேய்ய்ய் Today
796,0,When all your colleagues are going for a break You are working on a critical task Neenga ponga naa vare #muthumc VIDEO v0r v@ VIDEO
59,0,Malena movie link vennum da 9:23 am 9:23 am 0 Malena movie link vennum da Maja than 9:33 am already download pannitan but 9:50 am Language issues Italian Ia iruku 9:50 am ishal_ sammy_ English Ia send pannu 9:50 am Vasama mukiyam 10:09 am Ennaku adha mukiyam 10:13 am Na bit scene vandha pakka matten kanna mudipen 10:13 am Na bit scene vandha pakka matten kanna mudipen Nee nallavan than nallavan than 10:20 am  V
1478,1,மங்கையின் கழுத்தை பார்த்தால் மணமாகவில்லையே 80 Fo~M மட BALAMIM3 நான் க்ரிஸ்டியன் டI மூதேவி என் பொண்ணு மூனாவது படிக்குது .
760,0,Tshirt 499 /- only @colorbytharam Hoodie 750 /- ~19 Ella collection uh tharama irundha enaya panrathu DI 0 NIA READY
616,0,Me opening my office laptop after long vacation leave vishal_ sammy_ vene
357,0,"After a fight between mom and dad They  - idhu ellathukum kaaranam needhan 8 ylo me till 9 pm mட wondered What did 1 do Wrong?"" LEVEL MEMES = = VER^ LEVEL"
1179,1,video call in 198Os.- P மீமாண்டி video call in 2k.
1342,1,gaajipuducha Munda &ndi ipdi pakura theuudiga Un Sumniiolo perusa Sodi sappurathuunu pakuran da Sappuna sappiteg urupan da Naiga vittuedukapeப matian daaripujasthi ah Iruhkudaema nalla oolu da iruhe
1027,1,RelativeAunty 5 Ethana masam di Qarun memes poge Chubbygi N paithyakari paithyakari adhuen thoppa di
491,0,Muthu Kutti m 8 Evalo dress vena office ku potu po aana atha anaikae thovachuru Apro thovachukalam nu ninakatha Patturuken sollure #muthumc 76040%00850~0 MUTHU MC
892,0,Me Enaku onnum venam ma. pasikala Suddenly Appa bought Fried rice U Leo Memes Amma Me Ceg P
254,0,Dharshan Just now Life was in stuck need to be productive ~Few minutes later opens private tab in browser #dharshanmc DUOPII Adar mmaleeo
1231,1,"JUNIKUW +DT -4"" 80'$&90'$ girls After buying colour saanthu pottu பuwriluad பர the GETIT ON dailghunt App Store Google Play"
419,0,Na first time poi patha match than thokanuma vishal_sammy_ mt
870,0,Mobile என்னாதான் என்னோட Owner மழைல நனைஞ்சாலும் . என்னைய் நனையாமா பாத்துகிரார்ல சார் அந்த நல்ல மனசு தான் சார் கடவள .
1371,1,*BESTII MII TAMIL HOI WEIS HIY DINIIUIII ADIPIVI GOIBIIE STUDI NU SOUITO IPPO I AIDIGHU UIDURII AIDIGHU VIDA SOLLURA SUI VEHIIA EU IINE COUDMINE YEPPHISEIIMI IRUDH NAIII PERUSA Dn UNNIKU SUGIMI PINWI VIIURI
273,0,She He must be thinking about other girls Actually Me Adipurush Total budget 7oOcr Adipurush oda runtime 2.59 Min. Kanaku pota one min of movie cost 3
1343,1,HAT Gleu: AVAN Po***LA PAev NA HAN FesT sAPPI EDUPAN AUNI: HaY PODI PASANGALUKU PONNA VIDA AUNI QAN ROATBA PUDIKUh DI NA 7AN FIes7T SAPPI EDUPAN
615,0,Dharshan Just now இளநீர் எவ்ளோ??? ~ 7Ors Ila vena nan thanni kudichikiren dharshan LEVEL MEME$ = = VE*^ LEVFL
346,0,When Dad and Mom come to know that / ate non veg outside during Puratasi dharshan _ LEVEL MEMES  = = VER^ LFVEL
1102,1,10 வருசத்துக்கு முன்னாடி நீதான் என் புருஷன்னு சொன்னவ
1292,1,dei Isu etho vilatuku pesura nu paatha;nejamave kulichitu ammanama vanthu nikura en munna Anni enna da ithu pipe ah paathi ah odachu neetuna maari neetikitu nikura unga anna ku elam ipdi ilaye
1494,1,"கல்யாணம் ஆன புதுசுல பப ப wife இரவு டிபன் வீட்டுக்கு ரெடியா வரும்போது Husband சில வருசத்துக்கு அப்பால IWP memes ""pu- locc0oo com/oioe wolct ரவு டிபன் வீட்டுக்கு ுக்கா வரும்போதும் இல்லையா"
743,0,Me: Nalla paiyanalam pathu love panna matiya? Intha k Yuki pon port :i pasangala tha pudikuma? frd: Avanum nallavan than
716,0,Ennadhaan Dubai Qatarnu Veli Naatla Pernaal Kondadunalum Kilekogi Dosango Namma Sondha Oorla Kondadra Feel Irukkadhu Doss na!
1047,1,Naa kooda part 1 Ia Ganga chandramukhi yaala thaan Loosu aana nu nenachen Ginge5gப Aprm thaan therinjidhu chandramukhi ye loosu thaan nu
637,0,"Sanjay Krishna 2hours ngo ""Ayyo Kadavule intha Periodsaa ponnungalukku tharama enaku thanthuru"
803,0,Iட UllraBANGAM Oore Rugged Vs Chocolate mu Poitu Iruku Nee Yaarupa *Me It Naa Innocent sir Boy Boy Boy
735,0,. P5155 30 WADE |13 AUSTRALIA BEAT PAKISTAN AND WENT TO FINALS IKIWIS *AUSSIES ENAMAMA SOWKIVAMA CUAINS
1729,0,முக்கியச்செய்தி மண்டும் ருதரதாண்டலம் பாவில் பீண்டும் ருத்ரதாண்டவம் ஆடத் தொடங்கிய கொரோளா தாய் வீட்டுக்கு போனால் அப்படி தான் உரிமையா இருப்பாங்க. அதையெல்லாம் குளறை சொல்லிக்கிட்டு . போம்மா. கம்முன்ணு
159,0,Muthu Kutti 11m When someone calls me while am sleeping Naa free ah irukura apo la enga da poningha #muthumc 0  (
744,0,defeated defending champions IAURRH PIJTU dpak 97 /- ECB nengalum ena marii dhn polae yepidi mt Nambala dhn easy ah upset akiranga
