image_id,labels,transcriptions
1273,0,Ithulam oru weekend ah da UB_NG Ea Vanthatu terile Ponethu terile Monday vanthu usure edukuthu
1631,0,Whenever a girl is being nice to me oru vela love ah irukumo ' aa @10~-1.0- mam8s Ilal
792,0,"ile Namma chennai oru oorac ila NY+ சென்னை CHENNAI CRமீம்ஸ் 0 Fb.cow/irfawAazzte HAPPIE 38WTH 8'DAY AUG 22'|639 ille Chawce  Chawce  pola ||0 C0}05"""
1688,0,WOMAN Means W: Wonderful Mother 0: Outstanding Friend M: Marvelous Daughter A: Adorable Sister N: Nicest gift of God to men யS *Me இந்த உலகத்துல வாழுர ரெக்க ல்லாத தேவதை daa பொண்ணுங்கலாம்
1607,0,ovaruthurukum oru visiyathula payithiyam playboyfriend ivanuku ponunga mela paithiyam gero
1408,1,Deii na office kilambitan da ipo om soldra ennalam mudiyathu vena saree lift pandran #wife இagூள் mene Hmc karUhick Deii saree kasakidatha da ahh uff porumaya pannu un Cbhu askatavef afangatha deii ya kaskatha ufff poi
504,0,Muthu Kutti Just now *when bench guy came for office* ingha Snap eduka thanae vantha po #muthumc
1483,0,Baby un face la edhum adi padala la Yen?? Illa Nila la edho rover erangi iruku sonnanga nu
62,0,When / am enjoying my with her without any fight She with a load of my mistakes & mB enna asinga paduthura insult pandra day LEVE( MEMES = VE^ LEVEL
267,0,When my relatives advise their kids Annan maari nalla mark edukanum sariyaa mt LEVE1 MEME5 = = VE^ LFVEL
1145,1,+ ஒல்லியா இருக்கேன்னு வருத்தபடாதடி ~ ஏன்டா பட்டாம்பூச்சி எப்போ குண்டா இருந்துச்சினு சொல்ல போறியா ? ~ இல்ல கொசு என்னைக்குடி குண்டா இருந்துச்சு . 4 0!
845,0,True friend always Will always be in our sorrow and joy varun =
295,0,Muthu Kutti 6m En da insta la pesura ipo Enoda WhatsApp last seen ai enoda aalu paarthu kondu irupal. #muthumc frnd *his bestie . ' *my Aovc
677,0,When / support for my cousin s love marriage My parents Purinju pochu daa purinju pochu 4 LFVEL LEVE1 JEME$ = =
1021,1,*Me TN68 PONUNG Haritha Mc frnd oruvela futurelaunakuivangalamari wife kedachaennadapannuva *My
1707,0,She Nanga Mens ku wish pannala Kuda Engaluku womens ku wish panrinBa He Annikum innikum ennikum mens na ipdi dhan day dav
505,0,Muthu Kutti Just now Seri neram aachu phone ah vachutu padukalam *Kosu continuously biting me* My phone  #muthumc
372,0,mc dharshan Senior dood searching knowledge in me ` MEM Google Play Enna da ulla onnumae ila LEV61 M641 = L[VEL
1544,0,She hii da He என்ன மெசேஜ்லாம் வருது She நெட் slow டா அதான் மெசேஜ் பண்ணி போகுதான்னு பாத்தேன் bye He நான் பாட்டுக்கு தானடி இருந்தேன் me சிவநேனு
536,0,Inga paara Anna sengalam series kadaisi vara savama usuroda irukaru *Kalaiyarasan mt *Me 0 Hy
968,0,தண்ணியில் ஓடும் தவளைக்கு குக்கூகுக்கூகம்பிளி தங்கச்சி குக்கூ குக்கூ )பிழ கூடம் அன்புள்ளதங்கை கம்பளிக்கு ன அண்ணன் தவளை எழுதுவது பூச்சி
957,0,ANNAPAPALOVE SISTER AT BROTHERS MARRIACE RA G HA v 0 # ^ R 5 # BROIHER AT SISTERS MARRIACE
1722,0,+10w +01 வாழ வேண்டும் என்று 1#1 111 நினைப்பவனுக்கு எந்த  +^LILEL விமர்சனத்தையும் TAMILVOICE( OM 1 :'-71 `~-~ --_ தூக்கி எறியும் தைரியம் 180  வர வேண்டும் !
110,0,Muthu Kutti Just now Oru kaalathula 5Ors 1OOrs gpay pannu da nu sollitu iruntha paya Nethu Vijay Antony concert pora inaiku AR Rahman concert poranae ya #muthumc RuttyMob in
1245,1,"ம னவி : ""பக்கத்துக்கு பிளாட் பரிமளாவுக்கு யாரோ 20000/ ரூபாவுக்கு பட்டுப் புடவை குடுதிருக்காங்களாம் - ரேயடியா பீத்திக்கிறா"" lalwzsmle யாரோ கணவர் : இல்லியேதள்ளுபடி போக 16000/ தானே ஆச்சு எப்படி மாட்டிக்கிட்டான் பாரு லூசுப்பய.. LownIoad பn th= GETIT OIN dailghunt App Store Google gift Play"
1768,0,ஒரு தோசைக்கே ரண்டு வகை சட்னி ருந்தால்தான் டிபன் கூட திருப்தியாக அமையும் இத வீட்ல சொன்னா வௌக்கமாறு தேடுற ங்கா
738,0,"மழை நிவாரண முகாமில் மோனிகா என்ற 1 வயது சிறுமிக்கு பிறந்தநாள் கொண்பாடிய துரைப்பாக்கம் போலசார் K8e""8 Thats what Heros do"
1759,0,ஙங்க விட்டில் டீ போடா சொல்லி கொடுக்கலயா emy fr அபய்ட பரயட= அடுத்தவர் உயிர் கூட விளையாட்கூடாது என சொல்லி கொடுத்து இருக்காங்க
1015,1,She : அம்மு ன்னைக்கு என்ன டா He : காந்தி ஜெயந்தி டி She டேய் +4 5+&% He: டி என்ன She ஒரு பேச்சுக்கு கூடஉன் வாயில இருந்து ன்னொரு பொண்ணு வர கூடாது டா அவ ஓத போதும் அதுக்கு ஈடே இல்லை veVO நாள் ஏன் ஆச்சு பேரு ஓலே ஏதும்
582,0,"Label webseries Directed byArjunRaja Kamaraj Tanya Hopeplays the lead holstor specials 4R 0 1 # ஈ ~ - -4 M = R_ 5 -6^7-1"" UL=H TEIFHIL -8 அப1'ஈ எஈ ஙப் n NL-==1!]1மF -5010#^1[FLHHUL +40099"""" ^! ?=^ 8#*^*#^1 ArunRajana content tharama dhairukum 19 ABEL"
426,0,Adipurush New movie posteris out ! FUMS ANO சயo0ULIION ஆதிபுருஷ் Summa solla koodadhu. 9 6 Kriti sanon paaka Apdiyae divine maariirukanga
362,0,Dharshan Just now Me watching Chennai and madurai pullingo reels #dharshanmc
330,0,Muthu Kutti Just now Using gpay for 5rs VS using debit card for 46rs #muthumc Unna vida chiiilla unna Chii. vida chii illa
1380,1,CIIESSE DAIIPO THA O ANNA VA(HI IPO NI CHINA P**LA THuKITU ADIADINUADICHITU PORA VATHUNIKIRA OHI THADAVATHA DAAPRM SARI VA ROOMKU O ANNA p**DA LA OUIGI UTHIDO UFFF VARATHUKULLA P**LA SAPI
1375,1,Leave time la list potu oora sutharavana vida room potu ku thi la kuthuravana than ponnungaluku pudikum
75,0,Dharshan Just now Oru naal kooda overthink pannama thongunadhu ila deva #depression CINL
896,0,தோனியின் முதல் காதலி விபத்தில் இறந்தார் தோனியை பற்றி யாருக்கும் தெரியாத கண்கலங்க வைக்கும் தருணங்கள்! S ஒு செம Interesting வீடியோ மக்களே Miss பணணாம பாருங்க! FUUL VIDEO UINKINMY BIO PIBARA  ஏIN
695,0,When she suddenly holds my hand while crossing the road ERRON
806,0,Vetri Mra Just now A simple and Happy life with the Right Person is enough Me : theditu irukaninu kidaikala !!   IIUIIN PIJII veriwra Speed -
19,0,Job illa Body fit ah illa Mandaila mudi illa Family assets illa Kaasu illa Idhula familylaaluku pudichadha vaangi tharanum nu aasa padra nelamaila namma illa LEVEL MEWE5 _ MEMI LEVEL
455,0,^ Fafa ah celebrate panradhuku aandai parambarais nu arutham ilaa rr dharshan _ Avar acting kaga dhan LEVE[ MEMES = = VEN^ LEVFL
819,0,அத்தை அலப்பறைகள் 10 வயதில்  நீ காலேஜ் படிச்சி முடி என்பொண்ணு உனக்குத்தான் 25 வயதில் Rahman Cdits நல்ல மாபிள்ளை இருந்தா சொல்லுடா பாப்பாவ வச்சிருவோம் கட்டி
1355,1,VAOA EN ANUBU THAHBI CHELAKUTII. AKHAKU ORU UMMAKOOU APAOITHAIRUKI KATTI PJDI AKNA VA CHA NAMBA AKHAKJ NAMBA MALA BVALAWU PASAH R/ CHAA NANBA ARIPURU CHINA PAYAN THAHMBILAH SALAPATHUIUUSE PANA VENDI IRURI ANALUHNALA SUGAHA IRURU
1356,1,ramil besrie meme sari sari seikram podhum nolla mari kaloffu class iruku nadichathu oh udone Kusiya paru sir kavala podotha na Qoso idhula martum fasf theera seepi vidran pulla
1708,0,mR Face wash Panna maarom mட 0 Aanaa filter use pannuvom
1132,0,Volog VIDEO
77,0,After listening Nitham oru Yutham audio bookon Kukufm சாவாங்க ன்னும் செத்து விழுவாங்க *AUDIENCE AALA PATHA DUMMY PIECEAH IRUKA
347,0,Muthu Kutti Just now Anirudh Ravichander In the climax The Hukum song is playing #muthumc Shiva Rajni
810,0,Contact @halinacuppingclinic for face prblms (^ 440 Customers Happy annachi YoUi CLINIC IMIJD HEAL JAJH
883,0,0r Flipkart & amazon ha vida products enga kammi rate la kedaikum enamma ooru kadai page la kedaikum paarunga Apadiye follow panitu ponga poi
1519,1,// ஹேய் எந்திரி // என்னிக்கிடா டைம் ஆகல mondag வேலைக்கு வேலைக்கு போய் போகணுமல்ல இருக்கேன்.. I0P memes iocebook com /ivptele ஹாப்பி சின்ன ஞாயித்து கிழமை (Mondog) நான்
239,0,மணிப்பூர் கொடூரம் அதிர்ச்சி மேல் அதிர்ச்சி மணிப்பூரில் நிர்வாணமாக இழுத்துச் செல்லப்பட்ட பெண்களில் ஒருவரின் கணவர் இந்திய ராணுவத்தில் பணியாற்றியது தெரியவந்துள்ளது! அசாம் ரெஜிமெண்ட்பிரிவில் சுபேதாராக இருந்த அவர் நான் நாட்டை காப்பாற்றினேன்; என் மனைவியையும் ஊரையும் காப்பாற்ற முடியவில்லை என சேனல் ஒன்றுக்கு வேதனையுடன் பேட்டியளித்துள்ளார் dharshan mt டவி LEVEL MEME5 = = VE;^ LEVEL
690,0,Me Dei ennada hotstar account work aagala recharge pannalaya Me after came to know hotstar is down Sorry da avasara pattu unna thititen நிர் 4 ஈ~VFENaom7 vishal_ sammy_ LEVEL WEME$ = = VER^ L[VEL
1354,1,thambi frd- ena akka rombha ah iruka? adachum ointment vangitu varava akka- adai night fulla doggy style la en ass ah drill panitu ipo akkava? pain
115,0,Vijay na cameo soli dhana kutitu vandhinga enna palakkam da idhellam 4 mc LLEVE[ WEME5 = LEVFL
1623,0,G} அழகான மனைவி அன்பான துணைவி அமைந்தாலே பேரின்பமே. அன்பா எங்கம்மா அமையறாங்க பூரா அடங்காபிடாரி தான் அமையதுங்க..
1568,1,Sachin JD 19h 8o Aditi Sankar Siruthai padam sk panni iruntha nalla irukkum என்னடி ஒப்னீயன் இது
1599,0,Tea-6ல ஊறின பன்னும்.. Facebool(-ல கரக்ட் பன்னுன பொண்ணும் ரொம்ப நேரத்துக்கு நிலைச்சிருக்காது..
777,0,LakshmiMv @mvlakshmibe56 Online shopping sites: Eppo pathalum productsa pathu favorites and wishlist Ia podraalae thavira
1526,1,பெண்கள் அழும் அவள் மூக்கில் இருந்துமுட்டை வந்தால் அவள்உன்னை உணமையாக நேசிக்கிறாள் என்று அர்த்தம் பொது ; g =
1441,1,கோலை முதல் பெண் டநர் ஷர்மிளா பணி நீக்கம் கோவையின் முதல் பெண் பேருந்து ஓட்டுநரான ஷர்மிளா பணியிலிருந்து நீக்கம் NENCS மீகி Behindகட்ப மீடியா எனக்கென்னமோஉன் மேலதான் சந்தேகமா இருக்கு ஒட்
124,0,Muthu Kutti 11m TLIM : are u busy  why are u not replying to my msg Me time sheet fill pannitu irunthe my lord #muthumc HUTHU NC
180,0,Adhan evlo prechana varudhu la breakup panikalam la LFVEL I Myfrnd Romba Dhooram vandhuttom full ah mudichutu dhan return varanum LEVEL [WF$ = = =
1187,0,"வாட்ஸ் அப் இல்லாத காலத்துல வாசல் படில உட்கார்ந்து 0ட55 மீ் ஸு 9 தஞ்சை பாலோ பொம்பளைங்க இப்படித்தான் ""குரூப் சாட்டிங்"" பண்ணிட்டு இருந்தாங்க 43500"
1656,0,அனைத்துமகளரும சாதாரண கட்டண பேருந்துகளில் மே 8 முதல் கட்டணமில்லாமல் பயணிக்கலாம் S]9 CQerkai pattia U ஆணடி 12பி பஸ் எத்தனை மணிக்கு வரும் எடுடாகைய. நானம் அம்பளதான் 7^ ~~ப நகரப்
611,0,தனியா இருந்தா எப்டிடா சந்தோஷமா இருக்க முடியும்  ! இவுர பாரு . HLUMIII தோ .
1578,0,Na oru you tube cooking channel start pana poren Unaku thaan samaika theriyathey epdi samaipa You tube paathu thaan
439,0,Muthu Kutti Just now Ur going to office to see ur crush But she is on leave #muthumc _1 NUIHONG
49,0,+*+ BYrs Old me ** Me playing with pakkathu veetu Nibbi !! Me நமக்கு ன்னிக்கு கல்யாணம் !! டும்டும்டும் கல்யாணம் முடிஞ்சுது னி பர்ஸ்ட்நைட் !! ஈடாடி தம்பி தம்பி
763,0,POV: 2035 IAUNIR PUJTI dpak 97 Appa nenga amma va enga pathinga 00 oru naal instagram Ia en comment ku reply panna
281,0,Conversation with your colleague in chat gone little embarrassing . Idhukku aprm epudra nimmadhiya thookam varum naan epdi da ava moonjila mulippen LE VEL MEME$ = = VE;^ L[VEL
543,0,Naanum Chinna vayasula irundhu pakrean ipo varaikum apdiyae alaga maintain panranga 190
544,0,DOUOMINBS First match loose panna dhan cup see more 46 0 dharshan LEVEL WEME$ = = LEVFL
1648,0,#her Maamfyar Anga paarungadi en Marumagala evlo adakkama irukanuu US Gifls ்l VENKAT little# princess Apada nama performance paathu nambitangaa BoyS
227,0,Me to cold Epo da climate change aagumnu irukka 4 LEVEL MEWE$ = = L[VEL
429,0,When / got valid point against her She : Vaaiya moodu pesadha 44 dharshan LEVEL WEME$ _ = LEVFL
427,0,MUTHUMC Omuhu ui *Manager discussing with TL to ratings* Dui
900,0,BEFORE MARRIAGE AFTER MARRIAGE D@0l SHOCKA KORA MEMES J{M VASANTH MC MAN ஈOMEDI Pesama Namalum Kalyanam paniralama
1268,1,Villoge பரிதாபங்கள் *lhol poolly Gudiyattam3oomemes ஏண்டியம்மா காலேஜ்க்கு போலயா வீட்டுலயே இருக்க *Me GUOWAIU36o கொரோனா வந்து செத்து போய்டுவேண்டி பைத்தியகாரி;பைத்தியகாரி
750,0,While watching lingilingilingidi song IURRR PIவT dpak 97 Lyrics avan kedakuran ithu kekka and pakka nalla iruku
1442,0,மன அழுத்தமா இருக்கேன்னு மீன்வாங்கி வளத்தேன் இப்பமீன் தொட்டி கழுவுறத நினைச்சா அதவிடமன அழுத்தமா இருக்கு தம்பி தம்பி
45,0,Dharshan Just now Dei epdi da ungaluku padutha udanae thookam varudhu #dharshanmc JulIL 9ட- Pov
388,0,Some one : en bro ino thungama iruka?  kosu *Me NUTHUMC
1458,0,Atlee : அது என்ன படம் ??? Scene புதுசா ருக்கே. யோவ் அது செந்தில் பாலாஜி Video யா பாl  ~111010
157,0,harry dawson (3ு) @_harrydawson people who don t sugar in their tea think have a masters degree in maturity -1} Deimeamaalumenakudiabetesdaa 0 put they LE VEL WEMES5  = = VE*^ LFVEL
153,0,Oru alavuku mela nammaku sleeping kedaiyadhu & dharshan _ Overthinking dhan LEVEL MEME$ = VE^ LEVEL
1216,1,/` v~ச For 7Os kids For 8Os kids கோகிலா teacher மல்லிகா teacher மீமாண்டி For 2k kids BusgosKds ஸ்வேதா teacher நாட்டாமை teacher da ஸNO
1029,1,Expectation BELIKE MAGHI Reality =
1138,1,@pugal4zOmemes Crush tying her hair expectation ^ 6 (# 1 TIUI PSYGHOLOGIGHL OFERATIONS 1! ஈ0L BAICAPILOT BLAGK sounn VUAh 1987 But reality
676,0,பணம் ரொம்ப இருந்தா நிம்மதி இருக்காது நிம்மதி இல்லாததே பணம் இல்லைன்னு டா  தான் LEVEL MEMES = = VER^ LFVEL
853,0,64 Proposal Expectation mt Endha Love you !! ~Reality உழவன் மீம்ஸ் Un kaala pudichi kekuran enniya love pannu pudi
382,0,After receiving KT for full day from senior dood He~Edhuna purinjidha ??? dharshan *Me LEVEL MEWE$ & = VE*^ LEVFL
1644,0,Seniors going to first year class Bxpectations senior vechitandadiun melakannu Mamaeanthaponnuunnd than pokkuthu pRueuPS N *vanthutandijoker Reolty P*nda
1422,1,ThongodhBAkkocethoenomosemokonokooo eopooidgepnoஸe @ bockshoblamced mayetunthochovoikhoiumo AKkogSeekiணஞyண vளikomumd Onokumodhanipoitkonoeutho Suddeny AKkosஞosbond3 ondஸீறehoவீoூene9 semoyocooperdteponunodiodhumondhobocksho vongumbodhhbsemodi Rctress Memer *Thangachi & aa Appo nethu namalapanunathu pom Gel
1460,1,Opening InstagraM Facebook பொதிய ஏத்தி வண்டியிலே பொள்ளாச்சி சந்தையிலே seeMOre Blazzy Rajesh m0c mம
1056,1,my bro amma mom en ponnu super ah samaippa avalukku theriyatha disheh illa bro mind : antha pakki ku Maggi ya thavira vera eathum theriyathel seiya
911,0,உழவன் மீம்ஸ் senoignemer Foodie's* Single s committed s Meen kozhambu Enaku sapade Aaga  Aaga neriya iruku ana sooru venam kojam tan irukey
653,0,POV~ you re loving other religion guylgirl Dad while watching love movies cursing be like ~ Indha maari veeta emathitu love panravangala konnu podradhula thappe illa mc AaddAada LEVEL MEMES  = = VE;^ LEVEL
411,0,Oru side unuku innoru side papa ku nu sollirupalae harshan_ ஆமாங்கய்யா! LEVEL |E#F$ = = LEVEL
846,0,six face memes PhatcGhia Me Naanum No shave noveme foஔaிam nu irukken NgSீend
1684,0,Women' $ Respect Women nu sonna morfum pothathu dlso Respect Men who Respecis Women Happy Day
727,0,Polimer ஞாயிற்றுக்கிழமைகளில் முழு NEHNS ஊரடங்கு தமிழக அரசு அறிவிப்பு தமிழகத்தில் அமலுக்கு வருகிறது இரவு நேர ஊரடங்கு ஒன்றாம் வகுப்பு முதல் 9ஆம் வகுப்பு வரை நேரடி வகுப்புகள்க்குத் தடை Kovama Kuttyma Repeab U
1351,1,amma adikadi pudichu sapduren nu thappa nenachi katha daaa mood amma appa va thavara vera yaruthayum pathathu ila athu enamo un kunju enaku romba pudichu pochu
1585,0,வீட்ல எப்பவும் சிரிப்பு சத்தம் கேக்குதே? மனைவி என் மேல பாத்திரத்த தூக்கி போடுவா. மேல படலேன்னா நான் சிரிப்பேன் பட்டதுன்னா அவள் சிரிப்பா
1090,1,*ஓணத்துக்கு saree கட்டிருந்தன்ல. எப்படி டா இருந்துச்சு.... ~ஓணானுக்கு saree கட்டுன மாதிரி ருந்துச்சு டி.. இa Omsiva ஸS 0 போம் JENES ~nG
944,0,.9 Me doesnt know how to fill bank challan form IIILIIB Dad + Unna padika vachadhuku unna la enna pana mudiyumo panita PRABA DE_VILLIERS S3I 0
601,0,GOod opening withan excellent evening and Night shows across TN Audience reports good Naganathan 0R @NnBANaganatha #Vaathi good opening with ) an excellent evening and Night shows across TN Audience reports 5?//^^^TUDIOS voIUNoun 3L0C|30S1E? CLASSES B E G1 N சவாத் Wuuon r Another blockbuster movie on cards for Dhanush day day good
1215,1,ராசாத்தி ரோசாப்பூ வாவாவா மெட்ராஸ் படஅம்மா அன்று மீமாண்டி இன்று ஹே
711,0,உனன தான்டா முதுகு கூன் போடாமல் நிமிர்ந்து உட்கார்
215,0,mt Boss avanga rathanavela character ah celebrate pannitu irukanga CடVEL *MariSelvaa dharshan _ mட வWI W + 0@uFய Enna da solra MEME$ = = VER^ LEVEL
60,0,[uubwiilrg KFC Crispy Days offer la 9 Peri Peri Strips 199 rupees only than. [மIITS Visayam Secret uh! Top
99,0,Muthu Kutti Just now *When itis your friends marriage* Neraya velaya vitutu unakaaga vanthu irukom nee tha room arrange panni kuduthutu bachelors party vachutu pora #muthumc GOUDMINES
1369,1,Me: Sorry de vechi thechitu dha irrudha theriyama ulla poidichi 39 bestie shhhh.... edukadha da nalla vegama adi ahhhh veliya
1147,1,தனக்கு குடுக்க பட்டது நான்கு வகையான சட்டினி அல்ல நான்கு நாளான சட்டினி என்பதை உணர்கிறார் அப்பாவி கணவன
1432,1,SALEM BUS STAND NIGHT AFTER 1O'CLOCK Hai variya da thambi கையா இல்ல வாயா SE்LVh 300 ruva than Ok va apo antha Erode bus nikkuthu paru anga va தம்பி WIMIS
440,0,Takkar movie official teaseris out now ! Adengapa. Modern love huh pathiivalo Open huh intresting huh solliirukanga
983,0,#Amma Epo dq veTuKu voruvd? 8 manika varen ma Time 8.01 Mom .
461,0,Status neraiya peru pathutanga. But yarume ethume reply send pannala 19:36 Adhuku 19:49 You Adhuku Ipdi pesa mudiyatha mathri msg panna conversation make panrathu 19:50 m Adafvanennangafvlo open ah pesraan pathil LEVEL WEME$ epdi ய = VER^ LEVEL
1318,1,ennaa nanum pathutey iruken adikadi enna orasurathum ahhh anni azhagu anni nu monangarthuma iruka rugged anni un asingam pudicha vela ellam enkita kaatatha thundu thunda aruthu kaaka ku potruven hyyy
1558,1,FB ADA Girl Bestie Ena da Apdi Paakura? Me: Nejamavey ne ponnu dhana? Una epdi paathalum aambala madhiri dhan d iruka
540,0,Sylesh $ Just now In Instagram Some reel content makers st person in your share list will love you or Znd person has crush on you... 3rd person owns you nuxes Me after seeing that: Dei paithiyakara pun*a.. kiruku ku*hiyan . poda angutu. & 4 LEVEL MEME$  = VE;^ LEVEL
1301,1,thooki vechu sorugi mola sappurathu ellam sorgam Have u drived before ?
1762,0,நீ futureக்கு time travel பண்ணனுமா ஒன்னும் இல்ல காலைல 6 மணிக்கு அரை தூக்கத்துல எந்திரி . இன்னும் 5 நிமிஷம் தூங்கிக்கலாம்னு படு.. 3 மணி நேரம் future time travel ஆகலேனா என்ன செருப்ப கொண்டி அடி TOM இப்ப க்கு
1195,1,மனைவியை அம்மா வீட்டுக்கு அனுப்பும் தருணம் பத்ரமா போயிட்டு பொறுமையா வl செல்லம் Download Dailyhunt on Store Play
447,0,mt Boss avanga rathanavela character ah celebrate pannitu irukanga CடVEL *MariSelvaa dharshan _ mட வWI W + 0@uFய Enna da solra MEME$ = = VER^ LEVEL
1294,1,avar munnaal thangachi tnangachI nu paasama koopduringa nu nenachan friend wife ippothan puriyuthu friend pondati ah thangachi nu kooptu avala koothiyala vechikarthu than ungala mari ambalainaaluku oudikum nu
205,0,Doctor: Sollu pa enna aachu /6 dharshan Sapta udanae aai varudhu doctor LEVEL MEME$ = = LFVEL
50,0,Vasanth Karthik 14 minutes ago When i argues with my mom Amma nee ellam suneeta sharma kaal kazhuvi kudichalum urupdamata da Me adhu yaar ma suneeta sharma? Amma : adhan 1OO ruba 1.5 kodi jeichaley youtube la vilambaram poduvaney junglee rummy Me : epomey akkam pakkathula irukkavan kooda thana ma compare pannuva ipa ennama YT vilambaram kooda la compare panra Dai_summa Iu_da ~ potu
342,0,0ue சiu '1 . Theriyum bro CSK dhan win pannuvanga nu ellam scripted dhan bro dharshan _ LE VEL MEME$ = = VE;^ LEVEL
